{
  "design": {
    "burnInSteps": 180,
    "conditions": [
      "scarcity_mutable",
      "neutral_bottleneck_mutable"
    ],
    "decomposition": "Delta_mu = sum_l 0.5(p0_l+p1_l)(mu1_l-mu0_l) + sum_l (p1_l-p0_l)0.5(mu0_l+mu1_l)",
    "extinctLineageConvention": "for lineages absent at final time, set mu1_l = mu0_l so disappearance is attributed entirely to reweighting",
    "primaryCriteria": {
      "deterministicReplayMatchesRUL021": "replayed post-shock deltas match source within 1e-12 and all final populations match",
      "exactCentroidDecomposition": "maximum vector reconstruction error <= 1e-9",
      "scarcityExceedsNeutralReweighting": "median paired scarcity-minus-neutral reweighting norm share >= +0.10",
      "scarcityLineageDirectionsHeterogeneousAndIdentifiable": "median pairwise within-lineage direction cosine <= 0.50 and >= 3 moving surviving lineages in at least 3/4 seeds",
      "scarcityMostlyReweighting": "median scarcity reweighting norm share >= 0.60"
    },
    "ruleDimensions": [
      "forage_weight",
      "hazard_avoidance",
      "exploration",
      "reproduction_threshold"
    ],
    "seedCount": 12,
    "seeds": [
      14003,
      14011,
      14029,
      14041,
      14057,
      14071,
      14087,
      14101,
      14119,
      14137,
      14153,
      14173
    ]
  },
  "experimentId": "RUL-025",
  "interpretationBoundary": "RUL-025 is a lineage-resolved decomposition of the engineered RUL-021 ALife system. Founder labels are bookkeeping identities, and the symmetric within-lineage/reweighting decomposition is descriptive rather than a biological Price-equation claim. A large reweighting term does not by itself establish natural selection.",
  "observerId": "OBSERVER-ALIFE-LINEAGE-MOTION",
  "primaryTest": {
    "criteria": {
      "deterministicReplayMatchesRUL021": true,
      "exactCentroidDecomposition": true,
      "scarcityExceedsNeutralReweighting": false,
      "scarcityLineageDirectionsHeterogeneousAndIdentifiable": true,
      "scarcityMostlyReweighting": true
    },
    "criteriaPassed": 4,
    "criteriaTotal": 5,
    "pilotSupported": false
  },
  "replayChecks": [
    {
      "bottleneckFractionAbsError": 0.0,
      "condition": "scarcity_mutable",
      "finalPopulationMatch": true,
      "postShockDeltaMaxAbsError": 0.0,
      "seed": 14003
    },
    {
      "bottleneckFractionAbsError": 0.0,
      "condition": "neutral_bottleneck_mutable",
      "finalPopulationMatch": true,
      "postShockDeltaMaxAbsError": 0.0,
      "seed": 14003
    },
    {
      "bottleneckFractionAbsError": 0.0,
      "condition": "scarcity_mutable",
      "finalPopulationMatch": true,
      "postShockDeltaMaxAbsError": 0.0,
      "seed": 14011
    },
    {
      "bottleneckFractionAbsError": 0.0,
      "condition": "neutral_bottleneck_mutable",
      "finalPopulationMatch": true,
      "postShockDeltaMaxAbsError": 0.0,
      "seed": 14011
    },
    {
      "bottleneckFractionAbsError": 0.0,
      "condition": "scarcity_mutable",
      "finalPopulationMatch": true,
      "postShockDeltaMaxAbsError": 0.0,
      "seed": 14029
    },
    {
      "bottleneckFractionAbsError": 0.0,
      "condition": "neutral_bottleneck_mutable",
      "finalPopulationMatch": true,
      "postShockDeltaMaxAbsError": 0.0,
      "seed": 14029
    },
    {
      "bottleneckFractionAbsError": 0.0,
      "condition": "scarcity_mutable",
      "finalPopulationMatch": true,
      "postShockDeltaMaxAbsError": 0.0,
      "seed": 14041
    },
    {
      "bottleneckFractionAbsError": 0.0,
      "condition": "neutral_bottleneck_mutable",
      "finalPopulationMatch": true,
      "postShockDeltaMaxAbsError": 0.0,
      "seed": 14041
    },
    {
      "bottleneckFractionAbsError": 0.0,
      "condition": "scarcity_mutable",
      "finalPopulationMatch": true,
      "postShockDeltaMaxAbsError": 0.0,
      "seed": 14057
    },
    {
      "bottleneckFractionAbsError": 0.0,
      "condition": "neutral_bottleneck_mutable",
      "finalPopulationMatch": true,
      "postShockDeltaMaxAbsError": 0.0,
      "seed": 14057
    },
    {
      "bottleneckFractionAbsError": 0.0,
      "condition": "scarcity_mutable",
      "finalPopulationMatch": true,
      "postShockDeltaMaxAbsError": 0.0,
      "seed": 14071
    },
    {
      "bottleneckFractionAbsError": 0.0,
      "condition": "neutral_bottleneck_mutable",
      "finalPopulationMatch": true,
      "postShockDeltaMaxAbsError": 0.0,
      "seed": 14071
    },
    {
      "bottleneckFractionAbsError": 0.0,
      "condition": "scarcity_mutable",
      "finalPopulationMatch": true,
      "postShockDeltaMaxAbsError": 0.0,
      "seed": 14087
    },
    {
      "bottleneckFractionAbsError": 0.0,
      "condition": "neutral_bottleneck_mutable",
      "finalPopulationMatch": true,
      "postShockDeltaMaxAbsError": 0.0,
      "seed": 14087
    },
    {
      "bottleneckFractionAbsError": 0.0,
      "condition": "scarcity_mutable",
      "finalPopulationMatch": true,
      "postShockDeltaMaxAbsError": 0.0,
      "seed": 14101
    },
    {
      "bottleneckFractionAbsError": 0.0,
      "condition": "neutral_bottleneck_mutable",
      "finalPopulationMatch": true,
      "postShockDeltaMaxAbsError": 0.0,
      "seed": 14101
    },
    {
      "bottleneckFractionAbsError": 0.0,
      "condition": "scarcity_mutable",
      "finalPopulationMatch": true,
      "postShockDeltaMaxAbsError": 0.0,
      "seed": 14119
    },
    {
      "bottleneckFractionAbsError": 0.0,
      "condition": "neutral_bottleneck_mutable",
      "finalPopulationMatch": true,
      "postShockDeltaMaxAbsError": 0.0,
      "seed": 14119
    },
    {
      "bottleneckFractionAbsError": 0.0,
      "condition": "scarcity_mutable",
      "finalPopulationMatch": true,
      "postShockDeltaMaxAbsError": 0.0,
      "seed": 14137
    },
    {
      "bottleneckFractionAbsError": 0.0,
      "condition": "neutral_bottleneck_mutable",
      "finalPopulationMatch": true,
      "postShockDeltaMaxAbsError": 0.0,
      "seed": 14137
    },
    {
      "bottleneckFractionAbsError": 0.0,
      "condition": "scarcity_mutable",
      "finalPopulationMatch": true,
      "postShockDeltaMaxAbsError": 0.0,
      "seed": 14153
    },
    {
      "bottleneckFractionAbsError": 0.0,
      "condition": "neutral_bottleneck_mutable",
      "finalPopulationMatch": true,
      "postShockDeltaMaxAbsError": 0.0,
      "seed": 14153
    },
    {
      "bottleneckFractionAbsError": 0.0,
      "condition": "scarcity_mutable",
      "finalPopulationMatch": true,
      "postShockDeltaMaxAbsError": 0.0,
      "seed": 14173
    },
    {
      "bottleneckFractionAbsError": 0.0,
      "condition": "neutral_bottleneck_mutable",
      "finalPopulationMatch": true,
      "postShockDeltaMaxAbsError": 0.0,
      "seed": 14173
    }
  ],
  "results": {
    "allReplayFinalPopulationsMatch": true,
    "maxReplayPostShockDeltaAbsError": 0.0,
    "medianScarcityMinusNeutralReweightingShare": 0.03782750564795728,
    "neutral": {
      "maxDecompositionError": 3.639448198906424e-16,
      "medianFinalLineageCount": 4.0,
      "medianLineageDirectionalCoherence": 0.0003518413798832389,
      "medianLineageHHIChange": 0.1931652307204208,
      "medianReweightingNormShare": 0.764334686359759,
      "medianTop3FinalLineageFraction": 0.8054298642533937,
      "medianWithinLineageNormShare": 0.23566531364024104,
      "runCount": 12
    },
    "scarcity": {
      "maxDecompositionError": 3.337258119553657e-16,
      "medianFinalLineageCount": 5.0,
      "medianLineageDirectionalCoherence": 0.1898801026869732,
      "medianLineageHHIChange": 0.17252582514487275,
      "medianReweightingNormShare": 0.7876626730569214,
      "medianTop3FinalLineageFraction": 0.7083333333333333,
      "medianWithinLineageNormShare": 0.2123373269430786,
      "runCount": 12
    },
    "scarcityRunsWithAtLeastThreeMovingSurvivorLineages": 12
  },
  "ruleSpaceId": "RSPACE-ALIFE-001",
  "runDecompositions": [
    {
      "condition": "scarcity_mutable",
      "decompositionError": 1.9748438260743943e-16,
      "finalLineageCount": 3,
      "finalLineageHHI": 0.3333333333333333,
      "lineageDirectionalCoherence": 0.3155693088030116,
      "lineageHHIChange": 0.2801101928374655,
      "movingSurvivorLineageCount": 3,
      "postShockDelta": [
        0.040356528889346266,
        -0.11558238220797246,
        0.05085731976779112,
        -0.041465993351803565
      ],
      "preLineageCount": 27,
      "preLineageHHI": 0.053223140495867766,
      "reconstructedDelta": [
        0.04035652888934645,
        -0.11558238220797241,
        0.05085731976779108,
        -0.041465993351803544
      ],
      "reweightingAlignmentWithTotal": 0.9901277921942035,
      "reweightingNorm": 0.11745028616403826,
      "reweightingNormShare": 0.8076631404317253,
      "reweightingVector": [
        0.020204763013422097,
        -0.10240101803645502,
        0.04593283656798748,
        -0.02811660188397762
      ],
      "seed": 14003,
      "top3FinalLineageFraction": 1.0,
      "withinAlignmentWithTotal": 0.8084292420767186,
      "withinLineageNorm": 0.027969605229367173,
      "withinLineageNormShare": 0.19233685956827465,
      "withinLineageVector": [
        0.020151765875924356,
        -0.0131813641715174,
        0.004924483199803599,
        -0.013349391467825928
      ]
    },
    {
      "condition": "neutral_bottleneck_mutable",
      "decompositionError": 1.4052397852374344e-16,
      "finalLineageCount": 3,
      "finalLineageHHI": 0.3333333333333333,
      "lineageDirectionalCoherence": 0.21942997143236878,
      "lineageHHIChange": 0.2801101928374655,
      "movingSurvivorLineageCount": 3,
      "postShockDelta": [
        -0.009196387612771306,
        0.0007290741002898282,
        -0.05225711662327914,
        -0.07584320193010757
      ],
      "preLineageCount": 27,
      "preLineageHHI": 0.053223140495867766,
      "reconstructedDelta": [
        -0.009196387612771181,